{
  "$schema": "../schemas/ecosystem-registry.v1.schema.json",
  "schema": "kingdom.quantum-ecosystems/v1",
  "as_of": "2026-08-31",
  "boundary": "Scores are dated KINGDOM prioritization judgments, not vendor rankings, procurement approval, scientific proof, partnership authority, or permission to use a provider. Revalidate volatile capabilities, versions, prices, regions, terms, standards, and security status before action.",
  "score_guide": {
    "value_now": "0 has no present scoped value; 5 can create durable value now without requiring speculative advantage.",
    "openness": "0 is inaccessible or inseparable from one provider; 5 has open specifications or implementations and credible exit paths.",
    "lock_in_risk": "0 has negligible coupling; 5 creates substantial technical, commercial, data, or governance dependence. Higher is worse."
  },
  "ecosystems": [
    {
      "id": "standards.openqasm3",
      "name": "OpenQASM 3",
      "category": "interchange-standard",
      "posture": "adopt",
      "value_now": 5,
      "openness": 5,
      "lock_in_risk": 1,
      "valuable_capability": "A human-readable circuit and hardware-description interchange with classical control and timing concepts.",
      "power_boundary": "Implementations may support only subsets, and accepted programs can still compile differently for each target.",
      "kingdom_move": "Preserve validated OpenQASM exports beside the canonical problem and lossless native sidecars.",
      "does_not_prove": "OpenQASM portability does not mean identical performance or feature support on every backend.",
      "source_urls": [
        "https://openqasm.com/versions/3.0/index.html",
        "https://openqasm.com/release_notes.html"
      ]
    },
    {
      "id": "standards.qir",
      "name": "Quantum Intermediate Representation Alliance",
      "category": "compiler-standard",
      "posture": "contribute",
      "value_now": 5,
      "openness": 5,
      "lock_in_risk": 1,
      "valuable_capability": "An LLVM-based interchange for heterogeneous classical-quantum compilation with explicit profiles.",
      "power_boundary": "A QIR version, profile, target quantum instruction set, and runtime contract are all needed; QIR is not a universal binary.",
      "kingdom_move": "Build conformance fixtures, round-trip tests, profile declarations, and readable evidence around QIR exports.",
      "does_not_prove": "QIR conformance does not prove that a target preserves every source-level semantic or hardware capability.",
      "source_urls": [
        "https://github.com/qir-alliance/qir-spec",
        "https://github.com/qir-alliance/qir-spec/blob/main/specification/README.md"
      ]
    },
    {
      "id": "framework.qiskit",
      "name": "Qiskit and IBM Quantum Compute Service",
      "category": "gate-framework-and-cloud",
      "posture": "experiment",
      "value_now": 5,
      "openness": 4,
      "lock_in_risk": 3,
      "valuable_capability": "Mature circuit construction, transpilation, primitives, simulators, error work, and chemistry tooling.",
      "power_boundary": "The open SDK and abstract primitives are distinct from IBM-managed execution and server-side features.",
      "kingdom_move": "Make Qiskit a first-class optional adapter while preserving circuits, observables, samples, passes, and mitigation settings outside IBM services.",
      "does_not_prove": "A result produced with a Qiskit or IBM mitigation workflow is not automatically portable or independently reproducible.",
      "source_urls": [
        "https://quantum.cloud.ibm.com/docs/guides/compute-services",
        "https://quantum.cloud.ibm.com/docs/en/guides/primitives",
        "https://quantum.cloud.ibm.com/docs/en/addons/qiskit-addon-sqd"
      ]
    },
    {
      "id": "framework.cirq-openfermion",
      "name": "Cirq, qsim, and OpenFermion",
      "category": "simulation-and-chemistry",
      "posture": "adopt",
      "value_now": 5,
      "openness": 5,
      "lock_in_risk": 2,
      "valuable_capability": "Strong circuit transformation, noise simulation, virtual-engine testing, and fermionic or chemistry representations.",
      "power_boundary": "Google hardware access is restricted and device-specific features create affinity even when the software is open.",
      "kingdom_move": "Use Cirq and qsim as an independent simulator lane and OpenFermion as a chemistry interchange layer.",
      "does_not_prove": "A Google-style virtual device is not access to, or evidence from, a physical Google processor.",
      "source_urls": [
        "https://quantumai.google/cirq/simulate/simulation",
        "https://quantumai.google/cirq/google/engine",
        "https://quantumai.google/openfermion"
      ]
    },
    {
      "id": "framework.pennylane-catalyst",
      "name": "PennyLane and Catalyst",
      "category": "hybrid-differentiable-framework",
      "posture": "adopt",
      "value_now": 4,
      "openness": 5,
      "lock_in_risk": 2,
      "valuable_capability": "Portable differentiable workflows, broad device plugins, and compiled hybrid quantum-classical programs.",
      "power_boundary": "Device plugins, gradient semantics, supported control flow, and compiler support vary; Catalyst remains under active development.",
      "kingdom_move": "Use it as the rapid research frontend when gradients matter while keeping experiment semantics outside QNodes.",
      "does_not_prove": "One source program does not guarantee equivalent gradients, cost, or execution semantics across plugins.",
      "source_urls": [
        "https://docs.pennylane.ai/en/stable/",
        "https://docs.pennylane.ai/projects/catalyst/en/latest/index.html",
        "https://docs.pennylane.ai/projects/catalyst/en/stable/dev/architecture.html"
      ]
    },
    {
      "id": "framework.cuda-q",
      "name": "NVIDIA CUDA-Q",
      "category": "heterogeneous-compute-toolchain",
      "posture": "experiment",
      "value_now": 4,
      "openness": 4,
      "lock_in_risk": 4,
      "valuable_capability": "A CPU, GPU, and QPU programming model with scalable simulation, dynamics, error-correction work, and hardware backends.",
      "power_boundary": "The open toolchain still gains its strongest operational advantage from NVIDIA CUDA infrastructure and follows its compiler model.",
      "kingdom_move": "Add after the portable local core, when a scoped Linux NVIDIA or HPC node exists; treat macOS execution as CPU-side only.",
      "does_not_prove": "Open source does not eliminate hardware, compiler, or roadmap affinity.",
      "source_urls": [
        "https://nvidia.github.io/cuda-quantum/latest/index.html",
        "https://nvidia.github.io/cuda-quantum/latest/using/backends/backends.html",
        "https://nvidia.github.io/cuda-quantum/latest/using/quick_start.html"
      ]
    },
    {
      "id": "broker.amazon-braket",
      "name": "Amazon Braket",
      "category": "multi-provider-cloud-broker",
      "posture": "experiment",
      "value_now": 4,
      "openness": 3,
      "lock_in_risk": 4,
      "valuable_capability": "One public route to several gate and neutral-atom QPUs plus local and managed simulators.",
      "power_boundary": "IAM, regions, S3, job containers, metrics, billing, and third-party hardware processing create multiple control and data boundaries.",
      "kingdom_move": "Use as the first optional multi-hardware bridge only after cost, region, credential, payload-minimization, retry, and cancellation gates exist.",
      "does_not_prove": "A broker normalizes procurement, not hardware semantics, privacy terms, or comparative performance.",
      "source_urls": [
        "https://docs.aws.amazon.com/braket/latest/developerguide/braket-devices.html",
        "https://docs.aws.amazon.com/braket/latest/developerguide/third-party-security.html",
        "https://github.com/amazon-braket"
      ]
    },
    {
      "id": "broker.azure-quantum-qdk",
      "name": "Microsoft QDK, resource estimator, and Azure Quantum",
      "category": "resource-estimation-and-cloud",
      "posture": "adopt",
      "value_now": 5,
      "openness": 4,
      "lock_in_risk": 3,
      "valuable_capability": "A local fault-tolerant resource estimator, QIR tooling, Q#, and access to several provider families.",
      "power_boundary": "The estimator can be used locally, while Azure workspaces, storage, provider availability, and billing create cloud coupling.",
      "kingdom_move": "Adopt the local estimator early and require physical-qubit, runtime, error-budget, and assumption fields for future-facing proposals.",
      "does_not_prove": "A resource estimate is not a roadmap promise or evidence that required hardware exists.",
      "source_urls": [
        "https://learn.microsoft.com/en-us/azure/quantum/overview-resources-estimator",
        "https://learn.microsoft.com/en-us/azure/quantum/qc-target-list",
        "https://learn.microsoft.com/en-us/azure/quantum/quantum-computing-target-profiles"
      ]
    },
    {
      "id": "hardware.quantinuum-pytket",
      "name": "Quantinuum and pytket",
      "category": "trapped-ion-and-compiler",
      "posture": "experiment",
      "value_now": 4,
      "openness": 4,
      "lock_in_risk": 3,
      "valuable_capability": "A strong compiler and backend abstraction plus advanced trapped-ion, emulator, adaptive-control, and QIR workflows.",
      "power_boundary": "Advanced control can be lost through a lowest-common-denominator frontend; Nexus, Guppy, and native behavior add affinity.",
      "kingdom_move": "Use for adaptive and QIR comparison work, preserving both portable and exact native artifacts.",
      "does_not_prove": "Successful conversion from another SDK does not prove preservation of every dynamic or native capability.",
      "source_urls": [
        "https://docs.quantinuum.com/tket/api-docs/backends.html",
        "https://docs.quantinuum.com/nexus/index.html",